searge,name,side,desc
func_78909_a,getGLCallListForPass,0,Takes in the pass the call list is being requested for. Args: renderPass
func_78910_b,setDontDraw,0,When called this renderer won't draw anymore until its gets initialized again
func_78911_c,stopRendering,0,
func_78912_a,distanceToEntitySquared,0,"Returns the distance of this chunk renderer to the entity without performing the final normalizing square root, for performance reasons."
func_78913_a,setPosition,0,Sets a new position for the renderer and setting it up so it can be reloaded with the new data for that position
func_78914_f,markDirty,0,Marks the current renderer data as dirty and needing to be updated.
func_78944_a,doCompare,0,
func_78946_a,sortByDistanceToEntity,0,Sorts the two world renderers according to their distance to a given entity.
func_79001_a,getTexturePack,0,
func_80003_ah,getPlayerUsageSnooper,0,
func_80006_f,getUniqueID,0,
func_80007_l,getDimensionName,0,"Returns the dimension's name, e.g. ""The End"", ""Nether"", or ""Overworld""."
func_82114_b,getPlayerCoordinates,0,Return the position for this command sender.
func_82115_m,getMaxRenderDistanceSquared,0,
func_82116_a,setSkullRotation,0,Set the skull's rotation
func_82117_a,getSkullType,0,Get the entity type for the skull
func_82118_a,setSkullType,0,Set the entity type for the skull
func_82120_c,getExtraType,0,"Get the extra data foor this skull, used as player username by player heads"
func_82124_t,addEffectsToPlayers,0,
func_82126_i,getPrimaryEffect,0,Return the primary potion effect given by this beacon.
func_82127_e,setSecondaryEffect,0,
func_82128_d,setPrimaryEffect,0,
func_82129_c,setLevels,0,Set the levels of this beacon's pyramid.
func_82130_k,getLevels,0,Return the levels of this beacon's pyramid.
func_82131_u,updateState,0,Checks if the Beacon has a valid pyramid underneath and direct sunlight above
func_82132_j,getSecondaryEffect,0,Return the secondary potion effect given by this beacon.
func_82141_a,copyDataFrom,0,"Copies important data from another entity to this entity. Used when teleporting entities between worlds, as this actually deletes the teleporting entity and re-creates it on the other side. Params: Entity to copy from, unused (always true)"
func_82142_c,setInvisible,0,
func_82144_au,doesEntityNotTriggerPressurePlate,0,Return whether this entity should NOT trigger a pressure plate or a tripwire.
func_82145_z,getMaxInPortalTime,0,Return the amount of time this entity should stay in a portal before being transported.
func_82147_ab,getPortalCooldown,0,Return the amount of cooldown before this entity can use a portal again.
func_82148_at,getTeleportDirection,0,
func_82150_aj,isInvisible,0,
func_82154_e,setIsAnvil,0,
func_82159_b,getArmorPosition,0,
func_82160_b,dropEquipment,0,Drop the equipment for this entity.
func_82161_a,getArmorItemForSlot,0,"Params: Armor slot, Item tier"
func_82163_bD,initCreature,0,Initialize this creature.
func_82164_bB,addRandomArmor,0,Makes entity wear random armor based on difficulty
func_82165_m,isPotionActive,0,
func_82166_i,getArmSwingAnimationEnd,0,"Returns an integer indicating the end point of the swing animation, used by {@link #swingProgress} to provide a progress indicator. Takes dig speed enchantments into account."
func_82167_n,collideWithEntity,0,
func_82168_bl,updateArmSwingProgress,0,Updates the arm swing progress counters and animation progress
func_82169_q,getCurrentArmor,0,
func_82170_o,removePotionEffect,0,Remove the specified potion effect from this entity.
func_82171_bF,canBeSteered,0,"returns true if all the conditions for steering the entity are met. For pigs, this is true if it is being ridden by a player and the player is holding a carrot-on-a-stick"
func_82183_n,getAIControlledByPlayer,0,Return the AI task for player control.
func_82185_r,setCollarColor,0,Set this wolf's collar color.
func_82186_bH,getCollarColor,0,Return this wolf's collar color.
func_82193_c,getAttackStrength,0,Returns the amount of damage a mob should deal.
func_82196_d,attackEntityWithRangedAttack,0,Attack the specified entity using a ranged attack.
func_82197_f,setAggressive,0,Set whether this witch is aggressive at an entity.
func_82198_m,getAggressive,0,Return whether this witch is aggressive at an entity.
func_82201_a,setSkeletonType,0,Set this skeleton's type.
func_82202_m,getSkeletonType,0,Return this skeleton's type.
func_82203_t,getWatchedTargetId,0,"Returns the target entity ID if present, or -1 if not @param par1 The target offset, should be from 0-2"
func_82205_o,isArmored,0,Returns whether the wither is armored with its boss armor or not by checking whether its health is below half of its maximum.
func_82227_f,setChild,0,Set whether this zombie is a child.
func_82228_a,startConversion,0,Starts converting this zombie into a villager. The zombie converts into a villager after the specified time in ticks.
func_82229_g,setVillager,0,Set whether this zombie is a villager.
func_82230_o,isConverting,0,Returns whether this zombie is in the process of converting to a villager
func_82231_m,isVillager,0,Return whether this zombie is a villager.
func_82232_p,convertToVillager,0,Convert this zombie into a villager.
func_82233_q,getConversionTimeBoost,0,Return the amount of time decremented from conversionTime every tick.
func_82235_h,getIsBatHanging,0,
func_82236_f,setIsBatHanging,0,
func_82238_cc,getHideCape,0,
func_82239_b,setHideCape,0,
func_82240_a,displayGUIBeacon,0,Displays the GUI for interacting with a beacon.
func_82241_s,getHideCape,0,
func_82242_a,addExperienceLevel,0,Add experience levels to this player.
func_82244_d,displayGUIAnvil,0,Displays the GUI for interacting with an anvil.
func_82245_bX,isSpawnForced,0,
func_82246_f,canCurrentToolHarvestBlock,0,"Returns true if the item the player is holding can harvest the block at the given coords. Args: x, y, z."
func_82247_a,canPlayerEdit,0,
func_82265_c,setEnabled,0,
func_82266_h,setDisabledTextColour,0,
func_82273_a,setFlatGeneratorInfo,0,
func_82274_h,getRenderItem,0,
func_82275_e,getFlatGeneratorInfo,0,
func_82294_a,addPreset,0,Add a flat world preset.
func_82295_i,getPresets,0,Return the list of defined flat world presets.
func_82297_a,addPresetNoFeatures,0,Add a flat world preset with no world features.
func_82299_h,getPresetIconRenderer,0,Return the RenderItem instance used to render preset icons.
func_82319_a,checkHotbarKeys,0,This function is what controls the hotbar shortcut check when you press a number key when hovering a stack.
func_82328_a,setDirection,0,
func_82331_h,dropItemStack,0,Drop the item currently on this item frame.
func_82333_j,getRotation,0,Return the rotation of the item currently on this frame.
func_82334_a,setDisplayedItem,0,
func_82335_i,getDisplayedItem,0,
func_82336_g,setItemRotation,0,
func_82338_g,setAlphaF,0,Sets the particle alpha (float)
func_82340_a,setPotionDamage,0,
func_82341_c,getMotionFactor,0,Return the motion factor for this projectile. The factor is multiplied by the original motion.
func_82342_d,isInvulnerable,0,Return whether this skull comes from an invulnerable (aura) wither boss.
func_82343_e,setInvulnerable,0,Set whether this skull comes from an invulnerable (aura) wither boss.
func_82347_b,clearInventory,0,"Clear this player's inventory, using the specified ID and metadata as filters or -1 for no filter."
func_82351_a,executeCommandOnPowered,0,"Execute the command, called when the command block is powered."
func_82352_b,setCommand,0,Sets the command this block will execute when powered.
func_82353_c,getCommand,0,Return the command this command block is set to execute.
func_82355_al,registerDispenseBehaviors,0,Register all dispense behaviors.
func_82356_Z,isCommandBlockEnabled,0,Return whether command blocks are enabled.
func_82357_ak,getSpawnProtectionSize,0,Return the spawn protection area's size.
func_82358_a,isUsernameIndex,0,Return whether the specified command parameter index is a username parameter.
func_82362_a,getRequiredPermissionLevel,0,Return the required permission level for this command.
func_82363_b,parseDouble,0,Parses a double from the given string or throws an exception if it's not a double.
func_82364_d,getDifficultyForName,0,Return the difficulty value for the specified string.
func_82366_d,getGameRules,0,Return the game rule set this command should be able to manipulate.
func_82369_d,getAllOnlineUsernames,0,Return all usernames currently connected to the server.
func_82370_a,getUsernameIndex,0,Return a command's first parameter index containing a valid username.
func_82371_e,getDistanceSquaredToChunkCoordinates,0,Return the squared distance between this coordinates and the ChunkCoordinates given as argument.
func_82372_a,getMovementDirection,0,Returns the movement direction from a velocity vector.
func_82375_f,getDefaultMinimumLevel,0,Gets the default minimum experience level (argument lm)
func_82376_e,getDefaultMaximumLevel,0,Gets the default maximum experience level (argument l)
func_82377_a,matchesMultiplePlayers,0,Returns whether the given pattern can match more than one player.
func_82378_b,hasArguments,0,Returns whether the given token has any arguments set.
func_82379_d,getDefaultMaximumRange,0,Gets the default maximum range (argument r).
func_82380_c,matchPlayers,0,Returns an array of all players matched by the given at-token.
func_82381_h,getArgumentMap,0,"Parses the given argument string, turning it into a HashMap&lt;String, String&gt; of name-&gt;value."
func_82382_g,getDefaultCount,0,"Gets the default number of players to return (argument c, 0 for infinite)"
func_82383_a,hasTheseArguments,0,Returns whether the given token (parameter 1) has exactly the given arguments (parameter 2).
func_82384_c,getDefaultMinimumRange,0,Gets the default minimum range (argument rm).
func_82385_b,matchPlayersAsString,0,Returns a nicely-formatted string listing the matching players.
func_82386_a,matchOnePlayer,0,Returns the one player that matches the given at-token.  Returns null if more than one player matches.
func_82392_a,bindTextureByURL,0,"Binds a texture that Minecraft will attempt to load from the given URL.  (arguments: url, localFallback)"
func_82394_a,renderTileEntitySkullAt,0,Render a skull tile entity.
func_82398_a,renderTileEntityBeaconAt,0,Render a beacon tile entity.
func_82403_a,renderFrameItemAsBlock,0,Render the item frame's item as a block.
func_82406_b,renderItemAndEffectIntoGUI,0,"Render the item's icon or block into the GUI, including the glint effect."
func_82441_a,renderFirstPersonArm,0,
func_82448_a,transferEntityToWorld,0,Transfers an entity from a world to another world.
func_82449_a,findPlayers,0,Find all players in a specified range and narrowing down by other parameters
func_82460_a,updateSoundLocation,0,Updates the sound associated with the entity with that entity's position and velocity. Args: the entity
func_82461_f,resumeAllSounds,0,Resumes playing all currently playing sounds (after pauseAllSounds)
func_82462_a,updateSoundLocation,0,"Updates the sound associated with soundEntity with the position and velocity of trackEntity. Args: soundEntity, trackEntity"
func_82463_b,setEntitySoundPitch,0,"Sets the pitch of the sound associated with the given entity, if one is playing. Args: the entity, the pitch"
func_82464_d,stopAllSounds,0,Stops all currently playing sounds
func_82465_b,isEntitySoundPlaying,0,"Returns true if a sound is currently associated with the given entity, or false otherwise."
func_82466_e,pauseAllSounds,0,Pauses all currently playing sounds
func_82467_a,playEntitySound,0,"If a sound is already playing from the given entity, update the position and velocity of that sound to match the entity. Otherwise, start playing a sound from that entity. Setting the last flag to true will prevent other sounds from overriding this one. Args: The sound name, the entity, the volume, the pitch, priority"
func_82468_a,setEntitySoundVolume,0,"Sets the volume of the sound associated with the given entity, if one is playing. The volume is scaled by the global sound volume. Args: the entity, the volume (from 0 to 1)"
func_82469_c,stopEntitySound,0,Stops playing the sound associated with the given entity
func_82482_a,dispense,0,Dispenses the specified ItemStack from a dispenser.
func_82485_a,playDispenseSound,0,Play the dispense sound from the specified block.
func_82486_a,doDispense,0,
func_82487_b,dispenseStack,0,"Dispense the specified stack, play the dispense sound and spawn particles."
func_82489_a,spawnDispenseParticles,0,Order clients to display dispense particles from the specified block and facing.
func_82499_a,getProjectileEntity,0,Return the projectile entity spawned by this dispense behavior.
func_82505_u_,isFlowerPot,0,Returns true only if block is flowerPot
func_82519_a_,onFinishFalling,0,Called when the falling block entity for this block hits the ground and turns back into a block
func_82520_a,onStartFalling,0,Called when the falling block entity for this block is created
func_82524_c,isRedstoneRepeaterBlockID,0,
func_82525_a,getIPositionFromBlockSource,0,
func_82526_n,dispense,0,
func_82529_a,makeWither,0,This method attempts to create a wither at the given location and skull
func_82530_a,getMetaForPlant,0,Return the flower pot metadata value associated with the specified item.
func_82531_c,getPlantForMeta,0,Return the item associated with the specified flower pot metadata value.
func_82532_h,getSeedItem,0,Generate a seed ItemStack for this crop.
func_82533_j,getCropItem,0,Generate a crop produce ItemStack for this crop.
func_82538_d,canConnectWallTo,0,Return whether an adjacent block can connect to a wall.
func_82543_e,isBlockStairsID,0,Checks if supplied ID is one of a BlockStairs
func_82547_a,comparePlayers,0,Compare the position of two players.
func_82558_j,getWalkSpeed,0,
func_82560_d,getRelativeVolumeDisabled,0,
func_82563_j,getShowCape,0,
func_82571_y,getGeneratorOptions,0,
func_82572_b,incrementTotalWorldTime,0,
func_82573_f,getWorldTotalTime,0,
func_82574_x,getGameRulesInstance,0,Gets the GameRules class Instance.
func_82579_a,getTagMap,0,Return the tag map for this compound.
func_82580_o,removeTag,0,Remove the specified tag.
func_82581_a,createCrashReport,0,Create a crash report which indicates a NBT read error.
func_82582_d,hasNoTags,0,Return whether this compound has no tags.
func_82591_c,getPoolSize,0,
func_82593_b,getPlaceSound,0,Used when a player places a block.
func_82595_a,putObject,0,Register an object on this registry.
func_82599_e,getFrontOffsetZ,0,Returns a offset that addresses the block in front of this facing.
func_82600_a,getFront,0,Returns the facing that represents the block in front of it.
func_82601_c,getFrontOffsetX,0,Returns a offset that addresses the block in front of this facing.
func_82615_a,getX,0,
func_82616_c,getZ,0,
func_82617_b,getY,0,
func_82618_k,getWorld,0,
func_82619_j,getBlockTileEntity,0,
func_82620_h,getBlockMetadata,0,
func_82621_f,getZInt,0,
func_82622_e,getYInt,0,
func_82623_d,getXInt,0,
func_82632_g,boostSpeed,0,Boost the entity's movement speed.
func_82633_h,isControlledByPlayer,0,Return whether the entity is being controlled by a player.
func_82634_f,isSpeedBoosted,0,Return whether the entity's speed is boosted.
func_82644_b,getWorldFeatures,0,Return the list of world features enabled on this preset.
func_82647_a,setBiome,0,Set the biome used on this preset.
func_82648_a,getBiome,0,Return the biome used on this preset.
func_82649_e,getDefaultFlatGenerator,0,
func_82650_c,getFlatLayers,0,Return the list of layers on this preset.
func_82651_a,createFlatGeneratorFromString,0,
func_82656_d,getMinY,0,"Return the minimum Y coordinate for this layer, set during generation."
func_82657_a,getLayerCount,0,Return the amount of layers for this set of layers.
func_82658_c,getFillBlockMeta,0,Return the block metadata used on this set of layers.
func_82659_b,getFillBlock,0,Return the block type used on this set of layers.
func_82660_d,setMinY,0,Set the minimum Y coordinate for this layer.
func_82667_a,getScatteredFeatureSpawnList,0,returns possible spawns for scattered features
func_82674_a,pickRandomCrop,0,Returns a crop type to be planted on this field.
func_82677_a,getRandomCrop,0,Returns a crop type to be planted on this field.
func_82684_a,getReputationForPlayer,0,Return the village reputation for a player
func_82686_i,isMatingSeason,0,Return whether villagers mating refractory period has passed
func_82687_d,isPlayerReputationTooLow,0,Return whether this player has a too low reputation with this village.
func_82688_a,setReputationForPlayer,0,Set the village reputation for a player.
func_82689_b,writeVillageDataToNBT,0,Write this village's data to NBT.
func_82690_a,readVillageDataFromNBT,0,Read this village's data from NBT.
func_82692_h,endMatingSeason,0,Prevent villager breeding for a fixed interval of time
func_82695_e,recreateStructures,0,
func_82704_a,isEntityApplicable,0,Return whether the specified entity is applicable to this filter.
func_82705_e,getAnimal,0,Return whether this creature type is an animal.
func_82708_h,setObjectWatched,0,
func_82709_a,addObjectByDataType,0,"Add a new object for the DataWatcher to watch, using the specified data type."
func_82710_f,getWatchableObjectItemStack,0,Get a watchable object as an ItemStack.
func_82711_a,setWatchableObjectWatched,0,Set whether the specified watchable object is being watched.
func_82712_a,parseDoubleWithDefault,0,parses the string as double or returns the second parameter if it fails.
func_82714_a,parseIntWithDefaultAndMax,0,parses the string as integer or returns the second parameter if it fails. this value is capped to par2
func_82715_a,parseIntWithDefault,0,parses the string as integer or returns the second parameter if it fails
func_82716_a,getRandomDoubleInRange,0,
func_82718_a,loginToMinecraft,0,
func_82719_a,writeCustomPotionEffectToNBT,0,Write a custom potion effect to a potion item's NBT data.
func_82720_e,getIsAmbient,0,Gets whether this potion effect originated from a beacon
func_82721_a,setSplashPotion,0,Set whether this potion is a splash potion.
func_82722_b,readCustomPotionEffectFromNBT,0,Read a custom potion effect from a potion item's NBT data.
func_82725_o,isMagicDamage,0,Returns true if the damage is magic based.
func_82726_p,setMagicDamage,0,Define the damage type as magic based.
func_82732_R,getWorldVec3Pool,0,Return the Vec3Pool object for this world.
func_82733_a,selectEntitiesWithinAABB,0,
func_82734_g,getChunkHeightMapMinimum,0,"Gets the heightMapMinimum field of the given chunk, or 0 if the chunk is not loaded. Coords are in blocks. Args: X, Z"
func_82736_K,getGameRules,0,Gets the GameRules instance.
func_82737_E,getTotalWorldTime,0,
func_82742_i,resetUpdateEntityTick,0,Resets the updateEntityTick field to 0
func_82743_f,getCreationCloudUpdateTick,0,retrieves the 'date' at which the PartiallyDestroyedBlock was created
func_82744_b,setCloudUpdateTick,0,saves the current Cloud update tick into the PartiallyDestroyedBlock
func_82746_a,broadcastSound,0,
func_82747_f,getWorldTypeID,0,
func_82752_c,isAdventure,0,Returns true if this is the ADVENTURE game type
func_82756_a,getGameRuleStringValue,0,Gets the GameRule's value as String.
func_82757_a,setValue,0,Set this game rule value.
func_82758_b,getGameRuleBooleanValue,0,Gets the GameRule's value as boolean.
func_82763_b,getRules,0,Return the defined game rules.
func_82764_b,setOrCreateGameRule,0,
func_82765_e,hasRule,0,Return whether the specified game rule is defined.
func_82766_b,getGameRuleBooleanValue,0,Gets the boolean Game Rule value.
func_82767_a,getGameRuleStringValue,0,Gets the string Game Rule value.
func_82768_a,readGameRulesFromNBT,0,Set defined game rules from NBT.
func_82769_a,addGameRule,0,Define a game rule and its default value.
func_82770_a,writeGameRulesToNBT,0,Return the defined game rules as NBT.
func_82773_c,hasImageData,0,Checks if urlToImageDataMap has image data for the given key
func_82774_a,setOverrideBlockTexture,0,Sets overrideBlockTexture
func_82775_a,renderBlockAnvil,0,Renders anvil
func_82776_a,renderBlockAnvilOrient,0,Renders anvil block with orientation
func_82777_a,renderBlockAnvilRotate,0,Renders anvil block with rotation
func_82778_a,renderBlockBeacon,0,Renders beacon block
func_82779_a,renderBlockWall,0,Renders wall block
func_82780_a,renderBlockFlowerpot,0,Renders flower pot
func_82781_a,getEnchantments,0,Return the enchantments for the specified stack.
func_82782_a,setEnchantments,0,Set the enchantments for the specified stack.
func_82787_a,findMatchingRecipe,0,
func_82789_a,getIsRepairable,0,Return whether this item is repairable in an anvil.
func_82790_a,getColorFromItemStack,0,
func_82810_a,createHangingEntity,0,Create the hanging entity associated to this item.
func_82812_d,getArmorMaterial,0,Return the armor material for this armor item.
func_82814_b,getColor,0,Return the color for the specified armor ItemStack.
func_82815_c,removeColor,0,Remove the color from the specified armor ItemStack.
func_82816_b_,hasColor,0,Return whether the specified armor ItemStack has a color.
func_82819_b,setHideAddress,0,
func_82820_d,isHidingAddress,0,
func_82829_a,renderCloudsCheck,0,Render clouds if enabled
func_82830_a,getNightVisionBrightness,0,Gets the night vision brightness
func_82833_r,getDisplayName,0,returns the display name of the itemstack
func_82834_c,setItemName,0,Sets the item's name (used by anvil to rename the items).
func_82836_z,getItemFrame,0,Return the item frame this stack is on. Returns null if not on an item frame.
func_82837_s,hasDisplayName,0,Returns true if the itemstack has a display name
func_82838_A,getRepairCost,0,"Get this stack's repair cost, or 0 if no repair cost is defined."
func_82839_y,isOnItemFrame,0,Return whether this stack is on an item frame.
func_82840_a,getTooltip,0,Return a list of strings containing information about the item
func_82841_c,setRepairCost,0,Set this stack's repair cost.
func_82842_a,setItemFrame,0,Set the item frame this stack is on.
func_82844_f,getToolCraftingMaterial,0,"Return the crafting material for this tool material, used to determine the item that can be used to repair a tool with an anvil"
func_82845_b,getArmorCraftingMaterial,0,"Return the crafting material for this armor material, used to determine the item that can be used to repair an armor piece with an anvil"
func_82846_b,transferStackInSlot,0,Called when a player shift-clicks on a slot. You must override this or you will crash when someone does that.
func_82847_b,removeCraftingFromCrafters,0,Remove this crafting listener from the listener list.
func_82848_d,updateRepairOutput,0,"called when the Anvil Input Slot changes, calculates the new result and puts it in the output slot"
func_82849_b,getStackSizeUsedInRepair,0,
func_82850_a,updateItemName,0,used by the Anvil GUI to update the Item Name being typed by the player
func_82851_a,getRepairInputInventory,0,
func_82863_d,getBeacon,0,Returns the Tile Entity behind this beacon inventory / container
func_82869_a,canTakeStack,0,Return whether this slot's stack can be taken from this slot.
func_82870_a,onPickupFromSlot,0,
func_82877_b,setPlayerWalkSpeed,0,
func_82879_c,sendSettingsToServer,0,Send a client info packet with settings information to the server
func_82883_a,getUnicodeFlag,0,Get unicodeFlag controlling whether strings should be rendered with Unicode fonts instead of the default.png font.
func_82889_a,getBatSize,0,"not actually sure this is size, is not used as of now, but the model would be recreated if the value changed and it seems a good match for a bats size"
func_83003_a,getMemoryReport,0,Returns a string with allocated and used memory.
func_83005_z,getBlockBoundsMinZ,0,returns the block bounderies minZ value
func_83006_A,getBlockBoundsMaxZ,0,returns the block bounderies maxZ value
func_83007_w,getBlockBoundsMaxX,0,returns the block bounderies maxX value
func_83008_x,getBlockBoundsMinY,0,returns the block bounderies minY value
func_83009_v,getBlockBoundsMinX,0,returns the block bounderies minX value
func_83010_y,getBlockBoundsMaxY,0,returns the block bounderies maxY value
func_83012_d,getnextPoolIndex,0,
func_83013_c,getlistAABBsize,0,
func_83015_S,getCurrentDate,0,returns a calendar object containing the current date
func_83017_b,unlockBlockBounds,0,Unlocks the visual bounding box so that RenderBlocks can change it again.
func_83018_a,setRenderBoundsFromBlock,0,"Like setRenderBounds, but automatically pulling the bounds from the given Block."
func_83019_b,overrideBlockBounds,0,"Like setRenderBounds, but locks the values so that RenderBlocks won't change them.  If you use this, you must call unlockBlockBounds after you finish rendering!"
func_83020_a,setRenderBounds,0,"Sets the bounding box for the block to draw in, e.g. 0.25-0.75 on all axes for a half-size, centered block."
func_85028_t,getClassToNameMap,0,
func_85030_a,playSound,0,
func_85032_ar,isEntityInvulnerable,0,Return whether this entity is invulnerable to damage.
func_85034_r,setArrowCountInEntity,0,sets the amount of arrows stuck in the entity. used for rendering those
func_85035_bI,getArrowCountInEntity,0,"counts the amount of arrows stuck in the entity. getting hit by arrows increases this, used in rendering"
func_85036_m,setCombatTask,0,sets this entity's combat AI.
func_85039_t,addScore,0,Add to player's score
func_85040_s,setScore,0,Set player's score
func_85044_b,drawItemStack,0,
func_85052_h,getThrower,0,
func_85054_d,searchForOtherItemsNearby,0,Looks for other itemstacks nearby and tries to stack them together
func_85055_a,makeCrashReport,0,Creates a crash report for the exception
func_85057_a,makeCategoryDepth,0,Creates a CrashReportCategory for the given stack trace depth
func_85058_a,makeCategory,0,Creates a CrashReportCategory
func_85062_a,callBlockDataValue,0,
func_85064_a,callBlockLocationInfo,0,
func_85071_a,getLocationInfo,0,"Returns a string with world information on location.Args:x,y,z"
func_85079_a,callBlockType,0,
func_85085_a,callSuspiciousClasses,0,
