searge,name,side,desc
func_72373_m,getAvailablePlayerDat,1,Returns an array of usernames for which player.dat exists for.
func_72374_b,onTick,1,self explanitory
func_72376_i,getOps,1,
func_72377_c,playerLoggedIn,1,Called when a player successfully logs in. Reads player data from disk and inserts the player into the world.
func_72378_q,getHostPlayerData,1,"On integrated servers, returns the host's player data to be written to level.dat."
func_72379_i,removeFromWhitelist,1,Remove the specified player from the whitelist.
func_72380_a,readPlayerDataFromFile,1,called during player login. reads the player information from disk.
func_72382_j,getPlayerList,1,
func_72383_n,isWhiteListEnabled,1,
func_72384_a,sendPacketToAllPlayers,1,sends a packet to all players
func_72385_f,syncPlayerInventory,1,sends the players inventory to himself
func_72386_b,addOp,1,"This adds a username to the ops list, then saves the op list"
func_72388_h,getWhiteListedPlayers,1,Returns the whitelisted players.
func_72389_g,saveAllPlayerData,1,Saves all of the players' current states.
func_72390_e,getBannedPlayers,1,
func_72391_b,writePlayerData,1,also stores the NBTTags if this is an intergratedPlayerList
func_72392_r,removeAllPlayers,1,"Kicks everyone with ""Server closed"" as reason."
func_72393_a,sendPacketToPlayersAroundPoint,1,"sends a packet to players within d3 of point (x,y,z)"
func_72394_k,getCurrentPlayerCount,1,Returns the number of players currently on the server.
func_72395_o,getViewDistance,1,Gets the View Distance.
func_72396_a,sendPacketToAllPlayersInDimension,1,Sends a packet to all players in the specified Dimension
func_72397_a,sendToAllNearExcept,1,"params: srcPlayer,x,y,z,d,dimension. The packet is not sent to the srcPlayer, but all other players where dx*dx+dy*dy+dz*dz<d*d"
func_72398_c,getPlayerListAsString,1,returns a string containing a comma-seperated list of player names
func_72399_a,allowUserToConnect,1,"checks ban-lists, then white-lists, then space for the server. Returns null on success, or an error message"
func_72417_t,loadOpsList,1,
func_72418_v,readWhiteList,1,
func_72419_u,saveOpsList,1,
func_72420_s,getDedicatedServerInstance,1,
func_72421_w,saveWhiteList,1,
func_72429_b,getIntermediateWithXValue,1,"Returns a new vector with x value equal to the second parameter, along the line between this vector and the passed in vector, or null if not possible."
func_72430_b,dotProduct,1,
func_72432_b,normalize,1,Normalizes the vector to a length of 1 (except if it is the zero vector)
func_72433_c,lengthVector,1,Returns the length of the vector.
func_72434_d,getIntermediateWithZValue,1,"Returns a new vector with z value equal to the second parameter, along the line between this vector and the passed in vector, or null if not possible."
func_72435_c,getIntermediateWithYValue,1,"Returns a new vector with y value equal to the second parameter, along the line between this vector and the passed in vector, or null if not possible."
func_72436_e,squareDistanceTo,1,The square of the Euclidean distance between this and the specified vector.
func_72438_d,distanceTo,1,"Euclidean distance between this and the specified vector, returned as double."
func_72439_b,setComponents,1,"Sets the x,y,z components of the vector as specified."
func_72440_a,rotateAroundX,1,Rotates the vector around the x axis by the specified angle.
func_72441_c,addVector,1,"Adds the specified x,y,z vector components to this vector and returns the resulting vector. Does not change this vector."
func_72442_b,rotateAroundY,1,Rotates the vector around the y axis by the specified angle.
func_72443_a,createVectorHelper,1,"Static method for creating a new Vec3D given the three x,y,z values. This is only called from the other static method which creates and places it in the list."
func_72445_d,squareDistanceTo,1,"The square of the Euclidean distance between this and the vector of x,y,z components passed in."
func_72452_a,handleRemoveEntityEffect,1,Handle a remove entity effect packet.
func_72453_a,handleMapChunks,1,
func_72454_a,handleBlockEvent,1,
func_72455_a,handleLogin,1,
func_72456_a,handleBlockChange,1,
func_72457_a,handleLevelSound,1,
func_72458_a,handleClientCommand,1,
func_72460_a,handleSleep,1,
func_72461_a,handleAutoComplete,1,
func_72462_a,handleDoorChange,1,
func_72463_a,handleMapChunk,1,"Handle Packet51MapChunk (full chunk update of blocks, metadata, light levels, and optionally biome data)"
func_72464_a,handleCreativeSetSlot,1,Handle a creative slot packet.
func_72465_a,handleBlockDestroy,1,
func_72466_a,handleSpawnPosition,1,
func_72467_a,handleServerPing,1,Handle a server ping packet.
func_72468_a,handleTileEntityData,1,
func_72469_b,canProcessPacketsAsync,1,"If this returns false, all packets will be queued for the main thread to handle, even if they would otherwise be processed asynchronously. Used to avoid processing packets on the client before the world has been downloaded (which happens on the main thread)"
func_72470_a,handleServerAuthData,1,
func_72471_a,handlePlayerAbilities,1,Handle a player abilities packet.
func_72472_a,handlePlace,1,
func_72473_a,handleEntityAction,1,runs registerPacket on the given Packet19EntityAction
func_72474_a,handleCloseWindow,1,
func_72475_a,handleCollect,1,
func_72476_a,handleTransaction,1,
func_72477_a,handleKeepAlive,1,Handle a keep alive packet.
func_72478_a,handleEntityHeadRotation,1,
func_72479_a,handleEnchantItem,1,
func_72480_a,handlePlayerInfo,1,Handle a player information packet.
func_72481_a,handleChat,1,
func_72482_a,handleEntity,1,
func_72483_a,handleRespawn,1,respawns the player
func_72484_a,handleAttachEntity,1,Packet handler
func_72485_a,handleEntityStatus,1,Packet handler
func_72486_a,handleWindowItems,1,
func_72487_a,handleUpdateSign,1,Updates Client side signs
func_72488_a,handleGameEvent,1,
func_72489_a,isServerHandler,1,determine if it is a server handler
func_72490_a,handleSetSlot,1,
func_72491_a,handleDestroyEntity,1,
func_72492_a,handleKickDisconnect,1,
func_72493_a,handleEntityMetadata,1,Packet handler
func_72494_a,handleMapData,1,Contains logic for handling packets containing arbitrary unique item data. Currently this is only for maps.
func_72495_a,handleEntityPainting,1,Packet handler
func_72496_a,handleMultiBlockChange,1,
func_72497_a,handleUpdateTime,1,
func_72498_a,handleFlying,1,
func_72499_a,handleExplosion,1,
func_72500_a,handleClientProtocol,1,
func_72501_a,handleCustomPayload,1,
func_72502_a,handleBlockItemSwitch,1,
func_72503_a,handleEntityEffect,1,Handle an entity effect packet.
func_72504_a,handleClientInfo,1,
func_72505_a,handleUpdateProgressbar,1,
func_72506_a,handlePlayerInventory,1,
func_72507_a,handleUseEntity,1,
func_72508_a,handleWeather,1,Handles weather packet
func_72509_a,unexpectedPacket,1,Default handler called for packets that don't have their own handlers in NetServerHandler; kicks player from the server.
func_72510_a,handleBlockDig,1,
func_72511_a,handleVehicleSpawn,1,
func_72512_a,handleEntityTeleport,1,
func_72513_a,handleSharedKey,1,
func_72514_a,handleEntityExpOrb,1,Handle a entity experience orb packet.
func_72515_a,handleErrorMessage,1,
func_72516_a,handleOpenWindow,1,
func_72517_a,handleStatistic,1,runs registerPacket on the given Packet200Statistic
func_72518_a,handleNamedEntitySpawn,1,
func_72519_a,handleMobSpawn,1,
func_72520_a,handleEntityVelocity,1,Packet handler
func_72521_a,handleUpdateHealth,1,Recieves player health from the server and then proceeds to set it locally on the client.
func_72522_a,handleExperience,1,Handle an experience packet.
func_72523_a,handleWindowClick,1,
func_72524_a,handleAnimation,1,
func_72525_c,getSharedKey,1,Return the secret AES sharedKey
func_72526_a,getServerId,1,Returns the server Id randomly generated by this login handler.
func_72527_a,kickUser,1,Disconnects the user with the given reason.
func_72528_e,getUsernameAndAddress,1,
func_72529_d,initializePlayerConnection,1,"on success the specified username is connected to the minecraftInstance, otherwise they are packet255'd"
func_72530_b,getLoginMinecraftServer,1,Returns the reference to Minecraft Server.
func_72532_c,tryLogin,1,"Logs the user in if a login packet is found, otherwise keeps processing network packets unless the timeout has occurred."
func_72533_d,getClientUsername,1,Returns the connecting client username.
func_72565_c,kickPlayer,1,Kick the offending player and give a reason why
func_72566_d,handleSlashCommand,1,Processes a / command
func_72567_b,sendPacket,1,Adds the packet to the underlying network manager's send queue.
func_72568_e,getNumChunkDataPackets,1,return the number of chuckDataPackets from the netManager
func_72569_a,setPlayerLocation,1,Moves the player to the specified destination and rotation
func_72570_d,handlePackets,1,handle all the packets for the connection
func_72591_c,getRequestId,1,Returns the request ID provided by the client.
func_72592_a,getRandomChallenge,1,Returns the random challenge number assigned to this auth
func_72593_a,hasExpired,1,"Returns true if the auth's creation timestamp is less than the given time, otherwise false"
func_72594_b,getChallengeValue,1,Returns the auth challenge value
func_72601_a,registerSocket,1,Registers a DatagramSocket with this thread
func_72602_a,startThread,1,Creates a new Thread object from this class and starts running
func_72603_d,getNumberOfPlayers,1,Returns the number of players on the server
func_72604_a,closeSocket,1,Closes the specified DatagramSocket
func_72605_a,closeServerSocket_do,1,Closes the specified ServerSocket
func_72606_c,logWarning,1,Log warning message
func_72607_a,logDebug,1,Log debug message
func_72608_b,closeServerSocket,1,Closes the specified ServerSocket
func_72609_b,logInfo,1,Log information message
func_72610_d,logSevere,1,Log severe error message
func_72611_e,closeAllSockets,1,Closes all of the opened sockets
func_72612_a,closeAllSockets_do,1,Closes all of the opened sockets
func_72613_c,isRunning,1,"Returns true if the Thread is running, false otherwise"
func_72620_a,sendResponsePacket,1,Sends a byte array as a DatagramPacket response to the client who sent the given DatagramPacket
func_72621_a,parseIncomingPacket,1,"Parses an incoming DatagramPacket, returning true if the packet was valid"
func_72622_d,sendAuthChallenge,1,Sends an auth challenge DatagramPacket to the client and adds the client to the queryClients map
func_72623_a,stopWithException,1,Stops the query server and reports the given Exception
func_72624_b,createQueryResponse,1,Creates a query response as a byte array for the specified query DatagramPacket
func_72625_a,getRequestID,1,Returns the request ID provided by the authorized client
func_72626_g,initQuerySystem,1,Initializes the query system by binding it to a port
func_72627_c,verifyClientAuth,1,"Returns true if the client has a valid auth, otherwise false"
func_72628_f,cleanQueryClientsMap,1,Removes all clients whose auth is no longer valid
func_72645_g,cleanClientThreadsMap,1,Cleans up the clientThreads map by removing client Threads that are not running
func_72646_f,initClientThreadList,1,
func_72653_g,closeSocket,1,Closes the client socket
func_72654_a,sendResponse,1,Sends the given response message to the client
func_72655_a,sendMultipacketResponse,1,Splits the response message into individual packets and sends each one
func_72656_f,sendLoginFailedResponse,1,Sends the standard RCon 'authorization failed' response packet
func_72661_a,getBytesAsString,1,Read a null-terminated string from the given byte array
func_72662_b,getRemainingBytesAsLEInt,1,Read 4 bytes from the
func_72663_a,getByteAsHexString,1,Returns a String representation of the byte in hexadecimal format
func_72664_c,getBytesAsBEint,1,Read 4 bytes from the given array in big-endian format and return them as an int
func_72665_b,getBytesAsLEInt,1,Read 4 bytes from the given array in little-endian format and return them as an int
func_72667_a,writeInt,1,Writes the given int to the output stream
func_72668_a,writeShort,1,Writes the given short to the output stream
func_72669_b,reset,1,Resets the byte array output.
func_72670_a,writeByteArray,1,Writes the given byte array to the output stream
func_72671_a,writeString,1,Writes the given String to the output stream
func_72672_a,toByteArray,1,Returns the contents of the output stream as a byte array
func_72675_d,getStepSound,1,"Used when a entity walks over, or otherwise interacts with the block."
func_72676_a,getBreakSound,1,"Used when a block breaks, EXA: Player break, Shep eating grass, etc.."
func_72677_b,getVolume,1,
func_72678_c,getPitch,1,
func_72682_c,getChunkWatchersWithPlayers,1,
func_72683_a,addPlayer,1,Adds an EntityPlayerMP to the PlayerManager.
func_72685_d,updateMountedMovingPlayer,1,"update chunks around a player being moved by server logic (e.g. cart, boat)"
func_72686_a,getFurthestViewableBlock,1,Get the furthest viewable block given player's view distance
func_72687_a,markBlockNeedsUpdate,1,
func_72688_a,getMinecraftServer,1,Returns the MinecraftServer associated with the PlayerManager.
func_72689_b,getChunkWatchers,1,
func_72690_a,getPlayerInstance,1,passi n the chunk x and y and a flag as to whether or not the instance should be made if it doesnt exist
func_72691_b,filterChunkLoadQueue,1,Removes all chunks from the given player's chunk load queue that are not in viewing range of the player.
func_72692_a,getWorldServer,1,
func_72693_b,updatePlayerInstances,1,updates all the player instances that need to be updated
func_72694_a,isPlayerWatchingChunk,1,
func_72695_c,removePlayer,1,Removes an EntityPlayerMP from the PlayerManager.
func_72702_a,playRecord,1,"Plays the specified record. Arg: recordName, x, y, z"
func_72703_a,onEntityCreate,1,"Called on all IWorldAccesses when an entity is created or loaded. On client worlds, starts downloading any necessary textures. On server worlds, adds the entity to the entity tracker."
func_72704_a,playSound,1,"Plays the specified sound. Arg: soundName, x, y, z, volume, pitch"
func_72705_a,destroyBlockPartially,1,Starts (or continues) destroying a block with given ID at the given coordinates for the given partially destroyed value
func_72706_a,playAuxSFX,1,"Plays a pre-canned sound effect along with potentially auxiliary data-driven one-shot behaviour (particles, etc)."
func_72707_a,markBlockRangeForRenderUpdate,1,"On the client, re-renders all blocks in this range, inclusive. On the server, does nothing. Args: min x, min y, min z, max x, max y, max z"
func_72708_a,spawnParticle,1,"Spawns a particle. Arg: particleType, x, y, z, velX, velY, velZ"
func_72709_b,onEntityDestroy,1,"Called on all IWorldAccesses when an entity is unloaded or destroyed. On client worlds, releases any downloaded textures. On server worlds, removes the entity from the entity tracker."
func_72710_a,markBlockForUpdate,1,"On the client, re-renders the block. On the server, sends the block to the client (which will re-render it), including the tile entity description packet if applicable. Args: x, y, z"
func_72711_b,markBlockForRenderUpdate,1,"On the client, re-renders this block. On the server, does nothing. Used for lighting updates."
func_72784_a,sendPacketToTrackedPlayers,1,
func_72785_a,trackEntity,1,
func_72786_a,trackEntity,1,
func_72787_a,removePlayerFromTrackers,1,
func_72788_a,updateTrackedEntities,1,
func_72789_b,sendPacketToTrackedPlayersAndTrackedEntity,1,
func_72790_b,untrackEntity,1,
func_72791_a,trackEntity,1,
func_72796_p,getBlockTileEntity,1,"Returns the TileEntity associated with a given block in X,Y,Z coordinates, or null if no TileEntity exists"
func_72797_t,doesBlockHaveSolidTopSurface,1,Returns true if the block at the given coordinate has a solid (buildable) top surface.
func_72798_a,getBlockId,1,"Returns the block ID at coords x,y,z"
func_72799_c,isAirBlock,1,Returns true if the block at the specified coordinates is empty
func_72800_K,getHeight,1,Returns maximum world height.
func_72801_o,getLightBrightness,1,"Returns how bright the block is shown as which is the block's light value looked up in a lookup table (light values aren't linear for brightness). Args: x, y, z"
func_72803_f,getBlockMaterial,1,Returns the block's material.
func_72804_r,isBlockOpaqueCube,1,"Returns true if the block at the specified coordinates is an opaque cube. Args: x, y, z"
func_72805_g,getBlockMetadata,1,"Returns the block metadata at coords x,y,z"
func_72807_a,getBiomeGenForCoords,1,Gets the biome for a given set of x/z coordinates
func_72809_s,isBlockNormalCube,1,"Returns true if the block at the specified coordinates is an opaque cube. Args: x, y, z"
func_72819_i,getWeightedThunderStrength,1,
func_72820_D,getWorldTime,1,
func_72821_m,notifyBlockOfNeighborChange,1,"Notifies a block that one of its neighbor change to the specified type Args: x, y, z, blockID"
func_72823_a,setItemData,1,"Assigns the given String id to the given MapDataBase using the MapStorage, removing any existing ones of the same id."
func_72825_h,getTopSolidOrLiquidBlock,1,"Finds the highest block on the x, z coordinate that is solid and returns its y coord. Args x, z"
func_72826_c,getCelestialAngle,1,calls calculateCelestialAngle
func_72828_b,unloadEntities,1,adds entities to the list of unloaded entities
func_72829_c,checkBlockCollision,1,Returns true if there are any blocks in the region constrained by an AxisAlignedBB
func_72830_b,isAABBInMaterial,1,checks if the given AABB is in the material given. Used while swimming.
func_72831_a,rayTraceBlocks_do_do,1,
func_72832_d,setBlock,1,"Sets the block ID and metadata at a given location. Args: X, Y, Z, new block ID, new metadata, flags. Flag 1 will cause a block update. Flag 2 will send the change to clients (you almost always want this). Flag 4 prevents the block from being re-rendered, if this is a client world. Flags can be added together."
func_72834_c,canBlockFreeze,1,"checks to see if a given block is both water, and cold enough to freeze - if the par4 boolean is set, this will only return true if there is a non-water block immediately adjacent to the specified block"
func_72835_b,tick,1,Runs a single tick for the world
func_72836_a,scheduleBlockUpdate,1,Used to schedule a call to the updateTick method on the specified block.
func_72837_a,setBlockTileEntity,1,"Sets the TileEntity for a given block in X, Y, Z coordinates"
func_72838_d,spawnEntityInWorld,1,Called when an entity is spawned in the world. This includes players.
func_72839_b,getEntitiesWithinAABBExcludingEntity,1,"Will get all entities within the specified AABB excluding the one passed into it. Args: entityToExclude, aabb"
func_72840_a,getCollidingBlockBounds,1,calculates and returns a list of colliding bounding boxes within a given AABB
func_72841_b,getUniqueDataId,1,Returns an unique new data id from the MapStorage for the given prefix and saves the idCounts map to the 'idcounts' file.
func_72842_a,getBlockDensity,1,"Gets the percentage of real blocks within within a bounding box, along a specified vector."
func_72843_D,setRandomSeed,1,puts the World Random seed to a specific state dependant on the inputs
func_72844_a,getEntityPathToXYZ,1,
func_72845_h,markBlockForUpdate,1,"On the client, re-renders the block. On the server, sends the block to the client (which will re-render it), including the tile entity description packet if applicable. Args: x, y, z"
func_72846_b,getClosestVulnerablePlayer,1,"Returns the closest vulnerable player within the given radius, or null if none is found."
func_72847_b,releaseEntitySkin,1,Decrement the reference counter for this entity's skin image data
func_72849_a,getBlockLightValue_do,1,"Gets the light value of a block location. This is the actual function that gets the value and has a bool flag that indicates if its a half step block to get the maximum light value of a direct neighboring block (left, right, forward, back, and up)"
func_72850_v,isBlockFreezableNaturally,1,checks to see if a given block is both water and has at least one immediately adjacent non-water block
func_72851_f,notifyBlockChange,1,"The block type change and need to notify other systems  Args: x, y, z, blockID"
func_72852_a,addTileEntity,1,
func_72853_d,getMoonPhase,1,
func_72854_c,updateAllPlayersSleepingFlag,1,Updates the flag that indicates whether or not all players in the world are sleeping.
func_72855_b,checkNoEntityCollision,1,"Returns true if there are no solid, live entities in the specified AxisAlignedBB"
func_72856_b,getClosestVulnerablePlayerToEntity,1,"Returns the closest vulnerable player to this entity within the given radius, or null if none is found"
func_72857_a,findNearestEntityWithinAABB,1,
func_72858_w,canSnowAt,1,Tests whether or not snow can be placed at a given location
func_72860_G,getSaveHandler,1,Returns this world's current save handler
func_72861_E,getSpawnPoint,1,Returns the coordinates of the spawn point
func_72863_F,getChunkProvider,1,gets the world's chunk provider
func_72864_z,isBlockIndirectlyGettingPowered,1,"Used to see if one of the blocks next to you or your block is getting power from a neighboring block. Used by items like TNT or Doors so they don't have redstone going straight into them.  Args: x, y, z"
func_72865_a,getPathEntityToEntity,1,
func_72866_a,updateEntityWithOptionalForce,1,"Will update the entity in the world if the chunk the entity is in is currently loaded or its forced to update. Args: entity, forceUpdate"
func_72867_j,getRainStrength,1,Not sure about this actually. Reverting this one myself.
func_72868_a,addLoadedEntities,1,"adds entities to the loaded entities list, and loads thier skins."
func_72869_a,spawnParticle,1,"Spawns a particle.  Args particleName, x, y, z, velX, velY, velZ"
func_72870_g,updateEntity,1,Will update the entity in the world if the chunk the entity is in is currently loaded. Args: entity
func_72872_a,getEntitiesWithinAABB,1,"Returns all entities of the specified class type which intersect with the AABB. Args: entityClass, aabb"
func_72873_a,doChunksNearChunkExist,1,Checks if any of the chunks within distance (argument 4) blocks of the given block exist
func_72874_g,getPrecipitationHeight,1,Gets the height to which rain/snow will fall. Calculates it if not already stored.
func_72875_a,isMaterialInBB,1,Returns true if the given bounding box contains the given material
func_72876_a,createExplosion,1,"Creates an explosion. Args: entity, x, y, z, strength"
func_72877_b,setWorldTime,1,Sets the world time.
func_72878_l,getIndirectPowerLevelTo,1,"Gets the power level from a certain block face.  Args: x, y, z, direction"
func_72879_k,isBlockProvidingPowerTo,1,"Is this block powering in the specified direction Args: x, y, z, direction"
func_72883_k,getFullBlockLightValue,1,gets the block's light value - without the _do function's checks.
func_72884_u,isBlockFreezable,1,checks to see if a given block is both water and is cold enough to freeze
func_72885_a,newExplosion,1,returns a new explosion. Does initiation (at time of writing Explosion is not finished)
func_72886_a,extinguishFire,1,"If the block in the given direction of the given coordinate is fire, extinguish it. Args: Player, X,Y,Z, blockDirection"
func_72887_b,isBlockNormalCubeDefault,1,"Checks if the block is a solid, normal cube. If the chunk does not exist, or is not loaded, it returns the boolean parameter."
func_72888_f,destroyBlockInWorldPartially,1,Starts (or continues) destroying a block with given ID at the given coordinates for the given partially destroyed value
func_72889_a,playAuxSFXAtEntity,1,See description for playAuxSFX.
func_72890_a,getClosestPlayerToEntity,1,"Gets the closest player to the entity within the specified distance (if distance is less than 0 then ignored). Args: entity, dist"
func_72891_a,setAllowedSpawnTypes,1,first boolean for hostile mobs and second for peaceful mobs
func_72892_b,scheduleBlockUpdateFromLoad,1,Schedules a block update from the saved information in a chunk. Called when the chunk is loaded.
func_72893_g,tickBlocksAndAmbiance,1,plays random cave ambient sounds and runs updateTick on random blocks within each chunk in the vacinity of a player
func_72896_J,isRaining,1,Returns true if the current rain strength is greater than 0.2
func_72898_h,notifyBlocksOfNeighborChange,1,"Notifies neighboring blocks that this specified block changed  Args: x, y, z, blockID"
func_72899_e,blockExists,1,"Returns whether a block exists at world coordinates x, y, z"
func_72900_e,removeEntity,1,Schedule the entity for removal during the next tick. Marks the entity dead in anticipation.
func_72901_a,rayTraceBlocks_do,1,
func_72902_n,markBlockForRenderUpdate,1,"On the client, re-renders this block. On the server, does nothing. Used for lighting updates."
func_72903_x,setActivePlayerChunksAndCheckLight,1,
func_72904_c,checkChunksExist,1,"Checks between a min and max all the chunks inbetween actually exist. Args: minX, minY, minZ, maxX, maxY, maxZ"
func_72905_C,getSeed,1,gets the random world seed
func_72906_B,checkSessionLock,1,Checks whether the session lock file was modified by another process
func_72907_a,countEntities,1,Counts how many entities of an entity class exist in the world. Args: entityClass
func_72908_a,playSoundEffect,1,"Play a sound effect. Many many parameters for this function. Not sure what they do, but a classic call is : (double)i + 0.5D, (double)j + 0.5D, (double)k + 0.5D, 'random.door_open', 1.0F, world.rand.nextFloat() * 0.1F + 0.9F with i,j,k position of the block."
func_72909_d,markBlockRangeForRenderUpdate,1,"On the client, re-renders all blocks in this range, inclusive. On the server, does nothing. Args: min x, min y, min z, max x, max y, max z"
func_72911_I,isThundering,1,Returns true if the current thunder strength (weighted with the rain strength) is greater than 0.9
func_72912_H,getWorldInfo,1,Returns the world's WorldInfo object
func_72913_w,commandToggleDownfall,1,start precipitation in this world (2 ticks after command posted)
func_72914_a,addWorldInfoToCrashReport,1,Adds some basic stats of the world to the given crash report.
